{
  "$schema": "https://json-schema.org/draft/2020-12/schema",
  "$id": "lws://meta-schema/state",
  "title": "Workspace State",
  "description": "The workspace's current runtime state. Conforms to the lifecycle declared in workspace/_contract.json.",
  "type": "object",
  "required": ["workspace_id", "created_at", "status", "meta_schema_version"],
  "properties": {
    "workspace_id": {
      "type": "string",
      "description": "Stable identifier for this workspace."
    },
    "title": {
      "type": "string",
      "description": "Display name."
    },
    "created_at": { "type": "string", "format": "date-time" },
    "last_modified": { "type": "string", "format": "date-time" },
    "status": {
      "type": "string",
      "description": "Current lifecycle state. Must be one of the states declared in workspace/_contract.json."
    },
    "current_workflow_stage": {
      "type": ["string", "null"],
      "description": "Current stage in the workspace's workflow (if it has one). Reference to a stage name in workspace/_contract.json."
    },
    "domain_hint": {
      "type": "string",
      "description": "Free-text tag for human navigation, e.g. 'personal-todo'."
    },
    "blueprint": {
      "type": ["string", "null"],
      "description": "Name of the blueprint this workspace was scaffolded from, if any."
    },
    "meta_schema_version": { "type": "string" }
  }
}
