{
  "workspace_id": "competitor-research",
  "title": "Plotpoint Competitor Research — Top 3",
  "created_at": "2026-04-15T09:00:00Z",
  "last_modified": "2026-04-28T14:00:00Z",
  "status": "operating",
  "current_workflow_stage": "researching",
  "domain_hint": "competitive-analysis",
  "blueprint": null,
  "meta_schema_version": "0.1"
}
