{
  "workspace_id": "master-todo",
  "title": "Master To-Do",
  "created_at": "2026-04-26T18:00:00Z",
  "last_modified": "2026-04-28T10:00:00Z",
  "status": "operating",
  "current_workflow_stage": null,
  "domain_hint": "personal-task-management",
  "blueprint": "personal-todo",
  "meta_schema_version": "0.1"
}
