{
  "workspace_id": "{{ generated_at_bootstrap }}",
  "title": "{{ workspace_title }}",
  "created_at": "{{ generated_at_bootstrap }}",
  "last_modified": "{{ generated_at_bootstrap }}",
  "status": "goal-defining",
  "current_workflow_stage": null,
  "domain_hint": "",
  "blueprint": null,
  "meta_schema_version": "0.1"
}
